title,company,location,modality,description
Data Analyst,Smadex,"Barcelona, Catalonia, Spain",Hybrid,"
Smadex is a leading advertising technology company founded in Barcelona in 2011 and sold to American-based and stock-listed Entravision in 2018 (NYSE::EVC). We are currently considered one of the top mobile ad-tech companies in the world, competing with American-based Liftoff and Korean-based Moloco, both in the pre-IPO stage and averaging about $500M in yearly revenues.
We are looking for a Data Analyst with strong SQL and analytics experience to join our Data Analysis Team. Working alongside our Data Engineers, the candidate should be communicative and analytical, in order to answer the complex questions that Product and Campaign performance are facing. For this purpose we use tons of data available to get powerful insights to resolve them, creating effective strategies to help improve the Smadex platform! 
The role is based in Barcelona!
Your tasks and responsibilities:Analyze large, complex data sets containing the behaviour of millions of mobile users and Apps worldwide to address strategic questionsObtain and Report insights from our Product´s performance (ML, Audiences, Creatives, Supply, etc) in order to make decisions that will impact revenue. Have one´s say!Develop automated dashboards and processes to ensure data influence decisions at all levels of the companyWorking cross-functionally with business and technical teams to support product performance
Skills and requirements:2+ years of experience as a Data AnalystWorking knowledge of SQL and large data sets, understanding of analytic methodologies for data evaluationBachelor's or Master's Degree in Engineering or BusinessStrong analytical skills with the ability to get insights.Outstanding communication and reporting skillsExcellent command of Microsoft Excel (Power Pivot & Power Query) Excellent communication skills in English both written and spoken are mandatoryPython/R, Superset, PowerBI experience is a plusDesire to join the ad-tech worldKnowledge of the ad-tech industry is a plus.
Please note that we do NOT provide VISA sponsorship. Candidates without a legal permit to work in Spain won't be considered. What is in it for you:Integrate a highly motivated and young teamGreat compensation packageTop location at the heart of Barcelona in a penthouse office with a rooftop terrace, Barbeque, and a fully stocked fridgeGreat work-life balance: work from home, flexible hoursLearning and training opportunitiesMeal vouchers - Tickets Restaurant monthly allowanceMonthly gym allowance to use in up to 30 DIR gyms around the cityMonthly TGIF eventsRegular team-building eventsFun and friendly work environment with talented marketers and engineers from over 21 countriesExposure to leading global app publishers (Zynga, King, Rovio, EA, etc.) and media partners in the digital advertising industryAnd more!
 "
Senior Game Data Analyst,Tilting Point,"Barcelona, Catalonia, Spain",Hybrid,"
At Tilting Point, we combine data, technology, talent and groundbreaking marketing to scale games to success. As the Senior Game Data Analyst, you will work closely with game teams to help inform decision-making regarding features of the game, balancing, player interactions, finding hidden opportunities and much more.
Your Future at Tilting PointAnalyze large, complex datasets to address ad-hoc and long-term operational and strategic business questionsDraw meaningful conclusions and provide actionable insights from data to shape and influence in-game features, economies, and future product roadmapsOwn the taxonomy for game data, ensuring all key performance metrics are measurable and can be analyzed efficiently.Present analytical findings as both written communication and visual representations that are clear, concise, and understandable, to both technical and non-technical audiences.Build relationships with stakeholders and processes around data deliverables to ensure data driven decisions can be made at all levels across Tilting PointCollaborate with all teams at Tilting Point, driving and supporting data and analytics related projects with game team, User Acquisition, Marketing, Engineering, and more
Your XP & SkillsEffectively communicate in English across verbal and written form.University degree (BA or BS) in Analytics, Economics, Mathematics, Statistics, Business Management, Information Systems, Computer Science or a related field3+ years of work experience as a data analyst or scientist, supporting consumer-facing products, mobile app/game preferredProficient with SQL2+ years with Python/R a plusAdept in at least one visualization tool such as TableauFamiliarity with PySpark and/or Amplitude a plusPassionate about mobile/social gaming with a good understanding of the market.
 "
Data Engineer Manager,HP,"Sant Cugat del Vallès, Catalonia, Spain",Hybrid,"
                HP is a Fortune 100 technology company with $58+ Billion in revenue, with over 50,000 employees operating in more than 170 countries around the world. We provide technology and services that help people and companies address their problems and challenges, and realize their possibilities, aspirations, and dreams. We apply new thinking and ideas to create simpler, more valuable, and trusted experiences with technology, continuously improving the way our customers live and work.

Position background

In the GTM analytics COE our mission is to deliver impact by building machine learning products to optimize pricing and marketing investments and provide guidance to our sales organization.

Those products are of high value to the company: Imagine affecting the marketing investments of all of HP products globally across all distribution channels utilizing ML.

In our production environment data science teams from each domain generate the first algorithmic models to solve questions such as: Should we invest more in search or display? Should we increase investment in keyword XXX in Google/AMZ on in keyword YYY?

To help there we are looking for a Principle data engineer that can help us bring machine learning algorithms to life from the front-end part all the way back to the decision engine

We offer an international experience, collaborative culture, top rate experience in AI and ML and opportunity to create significant real-world impact.

What You Will Do
Lead a team of data engineers that enable applications to build upon reliable dataWork with data science, product, and IT to understand the deployment requirement on one hand and the algorithmic/ data needs on the otherProvide recommendation on how to best bring the model into production (delivery method, algorithmic changes, coding changes)Help build and design the new solutionsWork with the team to productionize the solutions at scaleTake co-ownership of reliability, wait time and commercial results
What You Will Need
Bachelor’s in Engineering, Computer Science, statistics , Robotics or a related fieldExperience with cloud infrastructureExperience with modern application lifecycle management tools (Git, Visual Studio, Intellij, Code Reviews) .Experience with automated builds, tests and deployment of libraries on a compute cluster.Advanced understanding of Software Test methodologies, and an expert in testing tools. Strong General Project Management.
Who We Are

At HP, we believe in the power of ideas. We use ideas to put technology to work for everyone. And we believe that ideas thrive best in a culture of teamwork. That is why everyone – at every level in every function, is encouraged to think big, have original ideas and express and share them. We trust anything can be achieved if you really believe in it, and we will invest in your ideas to change lives and the way people work. This vision is what sets us apart as a company. At HP, we work across borders and without limits. Global virtual teams share resources, pool their big ideas to solve our biggest business opportunities. Everyone is valued for the unique skills, experiences and perspective they bring. That’s how we work at HP. And this is how ideas and people grow.

About HP

You’re out to reimagine and reinvent what’s possible—in your career as well as the world around you.

So are we. We love taking on tough challenges, disrupting the status quo, and creating what’s next. We’re in search of talented people who are inspired by big challenges, driven to learn and grow, and dedicated to making a meaningful difference.

HP is a technology company that operates in more than 170 countries around the world united in creating technology that makes life better for everyone, everywhere.

Our history: HP’s commitment to diversity, equity and inclusion – it's just who we are.

From the boardroom to factory floor, we create a culture where everyone is respected and where people can be themselves, while being a part of something bigger than themselves. We celebrate the notion that you can belong at HP and bring your authentic self to work each and every day. When you do that, you’re more innovative and that helps grow our bottom line. Come to HP and thrive!
 "
Senior Data Engineer,Scalapay,"Barcelona, Catalonia, Spain",Hybrid,"
                Thanks to our innovative BuyNow PayLater payment solution, Scalapay is transforming the way more than 2 million customers buy online and in-store, empowering 5,000+ merchants to give their customers magical shopping experiences.
Being only 3 years old didn’t stop us from becoming a unicorn 🦄 We have raised over $700mln and we did this thanks to a team built around our 4 core values: #createmagic #staycurious #beimpactful #playasateam.
This is where your magic happens. If you love it, Scalapay it ♥
THE MISSION
Data-driven decisions are the centre of our efforts to automate processes and support decisions across the business.
As Senior Data Engineer, your role will focus on developing distributed software for large-scale heterogeneous data processing, the development of ETL and reverse ETL pipeline.
You will be responsible for:
 Data modelling Data lineage Data quality / Data observability SLA, performance and scalability
You’ll be required to discuss requirements for data access and integrations with colleagues across the business, design solutions to the company’s problems and implement these using modern software processes in the cloud.
The role gives a large amount of autonomy and the chance to work with a top-notch team of experienced data experts.
Who we are looking for: 
 Strong Python and SQL experience Experience building and deploying ETL pipelines Experience with API integration Ability to scope projects and decompose work into tasks Familiarity with Linux-like development stacks, including Git, Kubernetes, etc Familiarity with AWS infrastructure (such as S3, Athena, Glue, etc) Knowledge of Data Modeling / Data Observability is a plus Ability to engage with colleagues on business processes A Bachelor's degree in computer science or a related field
Why you should join Scalapay:
 Attractive packages based on skills and experience International environment with significant challenges to be met every day Lots of opportunities to work with a team of industry tech leaders who are focused on delivering products that offer exceptional user experiences Personalised support to accelerate your professional growth and take ownership of the products you deliver: we want to help you grow! Latest technologies and being encouraged to bring your flair to the role
Recruitment Process:
 A quick chat with one of our Talent Acquisition team members The first interview with the Hiring Manager to deep dive into your experiences and better understand your motivation A case study to test your hard skills A Meet The Team session where you’ll get to meet different people at Scalapay and see if you’ll fit into our culture
_________________________________________________________________________
Want to learn more? Don't hesitate to explore our Careers website and Careers website, and our LinkedIn, WTTJ, Meritocracy and Glassdoor pages.
Pro tip: send your CV in English 😉
Super Pro tip: we know that application processes can be scary and frustrating but… we look for talent, not people that tick all our boxes.
We believe in the power of diversity: Scalapay is an Equal Opportunity Employer for any minority, disability, gender identity or sexual orientation.
 "
Data Analyst (Operations Team),Holaluz,"Barcelona, Catalonia, Spain",On-site,"
Description

¿Quiénes somos?

Somos Holaluz, la empresa que lleva una década revolucionando el sector energético. Nacimos para cambiar el mundo conectando a las personas con la energía verde 💡💚, y tú y el planeta sois nuestra motivación para ser como somos y hacer lo que hacemos.

Nuestra voluntad de hacer las cosas de un modo distinto, nos ha llevado a liderar la transformación del sector eléctrico y a ser la primera eléctrica en obtener el certificado BCorp.

¿Te sumas? Únete a la revolución.

¿Qué harás?

Formarás parte del Chapter de Data Analytics, con foco en el área de Operaciones.

¿Qué esperamos de ti?

Identificar las grandes necesidades de Data Analytics dentro del área de Operaciones y transformarlas en proyectos que impacten positivamente sus OKRs. Transformar los datos relativos a Operaciones y Customer Care en Insights accionables que mejoren la satisfacción de nuestras clientas y que hagan más eficiente el trabajo del equipo del área de Operaciones. También tendrás que comunicar toda la información crítica e insights a otros departamentos relevantes y a la empresa en general ya que Holaluz trabaja por y para el cliente.Mentorizar y dar soporte al resto de integrantes del equipo de Data Analytics que trabajan en el equipo de Customer Care y en Operaciones. El objetivo es ayudarles en su crecimiento profesionalRealizar la interlocución con todos los integrantes del área de Operaciones para asegurar que se cumplen los OKRs definidos y que también se atienden las necesidades surgidas del día a día. Deberás contribuir en la mejora contínua del área y para ello tendrás que empaparte de los procesos, la operativa y los retos para poder proponer mejorasParticipar activamente en la mejora continua del Chapter de Data Analytics: identificación de best practices, priorización de proyectos, puesta en marcha de modelos de Machine Learning, etc.Desarrollar una planificación clara y estructurada de los datos con el objetivo de identificar las oportunidades de mejora y conocer qué necesita el cliente externo e interno.Trabajar en la configuración de la infraestructura de datos de Operaciones que impacta en la gestión del cliente, incluidas las plataformas de análisis, almacenamiento y reporte de datos. Esta tarea la realizarás con el apoyo del Chapter de Data Analytics

Y como #SayThingsAsTheyAre es uno de nuestros valores, queremos ser claros y transparentes en explicarte qué harás durante tus primeros 6 meses en Holaluz.

En 1 mes...

Después del primer mes ya sabrás cómo está todo montado, te habrás empapado de la cultura y la visión, te habrás reunido con todos los equipos y sabrás qué es lo que hacen y qué necesitan.Empezarás a analizar las decisiones que han hecho los diferentes equipos y áreas para empezar a enfrentarte a tus primeros retos.También habrás ido a comer algún día con las personas del equipo, habrás asistido a algunas de las sesiones que hacemos con el objetivo de que fluya el conocimiento.

En 3 meses...

Seguro que ya habrás tomado muchas decisiones sobre cómo aportar en Operaciones y en el Chapter de Data Analytics. Estarás trabajando codo a codo con tus colegas, en otras palabras, habrás visto la LUZ.Habrás disfrutado de algún team building con el equipo y habrás tenido la oportunidad de hacer más de una presentación.

En 6 meses...

Tendrás (casi) todo bajo control y habrás contribuido en la madurez y crecimiento de tu equipo. Habrás aportado valor más allá de tu equipo compartiendo conocimiento, y haciendo valer toda tu experiencia para mejorar el área de Operaciones y el Chapter de Data Analytics.Además, habrás tenido varias reuniones con tu responsable para saber cómo te sientes en tus primeros meses con Holaluz.

¿Cómo lo harás?

Otro de nuestros valores es #KeepRowing o seguir remando, lo que significa que el trabajo en equipo y la alineación del mismo es fundamental para poder avanzar y hacer frente a nuestros objetivos compartidos.

En Holaluz hemos construido un sistema organizativo robusto y en constante iteración, que nos permite adaptarnos a los constantes cambios que demanda la industria y lograr el propósito que perseguimos. En Holaluz las reuniones y decisiones se toman de forma colaborativa, fluye el feedback 🤟 entre los diferentes equipos y se fomenta el apoyo entre personas.

¿Con quién lo harás?

#AlwaysPeopleFirst es también un valor muy importante en Holaluz, y para nosotros es clave tener un buen equipo de trabajo, por eso te explicamos que somos un equipo de unas 800 personas con un ambiente inmejorable, y con las que tendrás la oportunidad de trabajar en tu día a día 😁.

Además, trabajarás de la mano con Adrià y Víctor de tu equipo de Data y junto con tus stakeholders. ¿Sabías que nuestro Chapter de Analytics está compuesto por casi el 50% de talento femenino? ¡Te presentamos a dos compañeras!

👩🏾‍🎤 Marta 

Matemática, valenciana y gran aficionada al baloncesto. Es muy fan de hacer listas para todo y darle un toque de humor a cada reunión. Marta combina sus múltiples hobbies con su pasión por una visualización bien estructurada. Y a pesar de tener muchas reuniones, si le ofreces tomar un café mientras comentáis algún tema, aceptará sin dudarlo.

🦹🏻‍♀️ Èlia

Es la más joven del equipo pero desborda sabiduría. Èlia es una optimista incorregible con un don para encontrar el lado bueno de las cosas. En 5min te contagiará su buen rollo. A la catalana del equipo le encanta la escalada y siempre busca nuevos retos con unas ganas inagotables por aprender de otras áreas. El saber no ocupa lugar.

¿Dónde lo harás?Qué mejor lugar para hacerlo que en nuestras oficinas de Barcelona a sólo 200 metros del mar 🌊. Esta excepcional ubicación al lado de la playa es perfecta para hacer un break con chapuzón y poder poner en práctica otro de nuestros valores #HaveFun.

Requirements

¿Qué necesitamos?

Hemos pensado muy muy bien lo que buscamos y lo que de verdad importa:

Licenciatura en Ciencias Empresariales/Económicas, Matemáticas o Ingeniería.Más de 5 años de experiencia en el campo de Data Analytics, y solvencia en el uso de SQL y de PythonHabilidades analíticas de alto nivel y capacidad de traducir información en insights accionables y en informes concisos.Storytelling y capacidad de comunicar las conclusiones de tus análisis.Capacidad para trabajar eficazmente en equipo.Gran atención a los detalles.No hace falta que seas Shakespeare, pero sí que puedas comunicarte en Inglés.

Todo suma, así que si tienes alguna de estas cosas SUMA Y SIGUE:

Formación y experiencia en análisis de datos y en el uso de modelos de analítica avanzada y Machine Learning.Elaboración de dashboards.Conocimientos de PowerBI.

Requisitos deseables:

Orientación al Cliente.Capacidad para mantener relaciones interpersonales.Alta capacidad de implicación, dedicación y motivación.Elevada orientación a la consecución de objetivos y al cumplimiento de resultados.Excelente capacidad de análisis.

Benefits

¿Qué ofrecemos?

Otro de los valores que nos caracteriza en Holaluz es #EsPosible. Por ello, ofrecemos una serie de medidas para que puedas desarrollarte 360º y conseguir todo aquello que te propongas, tanto a nivel personal como profesional:

La mayor fuente de nuestra energía: ¡nuestra gente!

Únete a una empresa donde las personas son lo primero, con un ambiente de trabajo inmejorable y un gran talento donde realmente vivimos nuestros valores. Para ello ofrecemos una serie de ventajas y beneficios que te permitirán estar apoyado tanto a nivel personal como profesional.

SOSTENIBILIDAD

Únete a la primera empresa de servicios eléctricos con certificación B Corp de Europa, y actualmente #1 en el ranking mundial ESG para compañías eléctricas.Tarifa competitiva de movilidad sostenible con eCooltra. Se trata de bicicletas y patinetes eléctricos, para que puedas llegar a la oficina de forma rápida y económica, utilizando un transporte individual y ecológico. 

SALUD Y BIENESTAR

Seguro médico privado con Adeslas.Suscripción de gimnasio a Andjoy (Gympass).Fruta ecológica todos los días.Té y café en la oficina. 

EQUILIBRIO TRABAJO-VIDA

Régimen de Retribución Flexible en guardería, transporte y comida con Cobee.Tarifa Wifi competitiva con Unique.Creemos en la autonomía y la responsabilidad personal por lo que ofrecemos horarios de trabajo flexibles y la opción de trabajar de forma remota 6 días al mes (19 por trimestre).Referencias: obtén recompensas si contratamos a personas talentosas que tú nos recomiendes para que se unan a Holaluz.Parking - mejores tarifas en W Hotel.Como empresa certificada Baby Friendly: Guardería interna para ayudar a integrar vida y trabajo a las nuevas familias.""Casals"" (campamentos durante los largos meses de verano pero también en otras vacaciones). 

AUTODESARROLLO

Eventos de creación de equipos.Acceso a contenidos de formación.Biblioteca propia, con contenidos muy diversos.Clases de idiomas gratuitas en clases de inglés, castellano y catalán. 

”Celebramos la diversidad en el mundo y queremos que nuestro equipo refleje esto de manera inclusiva. En Holaluz, estamos comprometidos con la igualdad de oportunidades de empleo independientemente de la etnia, religión, sexo, origen nacional, orientación sexual, edad, estado civil, discapacidad, género, identidad o expresión de género. Además, nos esforzamos por empoderar a las mujeres en el lugar de trabajo.”
 "
Data Engineer,Globant,"Barcelona, Catalonia, Spain",Hybrid,"
                We are a digitally native technology services company where innovation, design and engineering meet scale. We use some of the latest technologies in the digital and cognitive field to empower organizations in every aspect.
Right now, we’re looking for Data Engineers to join our team at Globant!
You will get the chance to:
Work with professionals who have created some of the most revolutionary solutions in their fields.Make an impact. Work in large-scale projects globally.Develop your career in our Studios. Each Studio represents deep pockets of expertise on the latest technologies and trends and delivers tailored solutions focused on specific challenges.Develop your career within an industry or multiple industries.Work in the city you want, and be nourished by cultural exchanges.Be empowered to choose your career path: we have more than 600 simultaneous projects, so you can choose where and how to work.Be part of an agile pod. Driven by a culture of self-regulated teamwork, each team -or POD- works directly with our customers with a full maturity path that evolves as they increase speed, quality and autonomy.

What would help you succeed:
Believe and love what you do.Enjoy solving problems.Have imagination and you love innovating.Being flexible & goal oriented.Advanced English skills.High performance analytics.Bachelor Degree in CV, Information Technology or related technical field.Experience with Java or Python.Practical experience in Azure.

At Globant we believe that an inclusive culture and a diverse environment makes us stronger. We encourage people to have an inclusive spirit as our global footprint expands. We seek to generate a place of inspiration and growth for everyone. A safe space, based on equity as a value, where everyone's careers can be promoted and developed in the same way. There is no innovation without diversity and there is no improvement without plurality.
Are you ready?
Job Segment:  Database, Developer, Java, Engineer, Equity, Technology, Engineering, Finance
 "
